id,name,established_in,used_by,frequency,purpose
100000,Flow Tracking,Exercise 1.3.2c,"Module 2.3 (Idea Trees), Module 3.5 (Daily Checklist)",Daily,Identify high-engagement activities for career planning
100001,Skill Sharpening,Exercise 1.5.1b,Module 3.5 (Daily Checklist),Daily (15+ min),Build expertise and competitive edge
100002,Mindfulness Practice,Exercise 1.5.3a,"Module 3.3 (Listening), Module 3.5 (Daily Checklist)",Daily (5-20 min),Develop mental discipline and emotional intelligence
100003,Reframing Failure,Exercise 2.2.3a,Module 3.5 (Daily Checklist),Weekly,Transform setbacks into growth opportunities
100004,Routine Tracking,Exercise 1.5.4a,Module 3.5 (implicitly),Daily,Maintain accountability and structure
